{
  "condicio": "https://condicio.dev/schema/condicio.schema.json",
  "specVersion": "0.1.0",
  "id": "urn:uuid:3a7b2f91-8c4d-4e1a-9f6b-2d5c7a3e8f1b",
  "contract": {
    "title": "Mutual Non-Disclosure Agreement",
    "type": "NDA",
    "description": "Mutual NDA between Acme Corp and Beta Inc for evaluation of strategic partnership.",
    "language": "en",
    "jurisdiction": "Delaware",
    "governingLaw": "This Agreement shall be governed by and construed in accordance with the laws of the State of Delaware.",
    "status": "executed",
    "contractId": "NDA-2026-0042",
    "executionDate": "2026-03-15",
    "effectiveDate": "2026-03-15",
    "expiryDate": "2028-03-14",
    "renewalTerms": "Automatically renews for successive one-year terms unless either party provides 30 days written notice."
  },
  "parties": [
    {
      "id": "party-acme",
      "name": "Acme Corporation",
      "alias": "Acme",
      "role": "disclosing party",
      "type": "corporation",
      "jurisdiction": "Delaware",
      "contact": {
        "address": {
          "street": "123 Innovation Drive",
          "city": "Wilmington",
          "stateOrProvince": "DE",
          "postalCode": "19801",
          "country": "US"
        }
      }
    },
    {
      "id": "party-beta",
      "name": "Beta Inc",
      "alias": "Beta",
      "role": "receiving party",
      "type": "corporation",
      "jurisdiction": "Delaware",
      "contact": {
        "address": {
          "street": "456 Venture Lane",
          "city": "Wilmington",
          "stateOrProvince": "DE",
          "postalCode": "19803",
          "country": "US"
        }
      }
    }
  ],
  "dates": [
    {
      "label": "execution",
      "date": "2026-03-15",
      "description": "Date both parties signed the agreement."
    },
    {
      "label": "effective",
      "date": "2026-03-15",
      "description": "Effective date of the NDA."
    },
    {
      "label": "expiry",
      "date": "2028-03-14",
      "description": "Initial two-year term."
    },
    {
      "label": "notice deadline",
      "date": "2028-02-13",
      "description": "Last date to provide non-renewal notice before auto-renewal (30 days before expiry)."
    }
  ],
  "clauses": [
    {
      "id": "1",
      "title": "Definition of Confidential Information",
      "text": "Confidential Information means any information, technical data, or know-how disclosed by one party to the other in connection with the Purpose, including but not limited to business plans, financial data, product roadmaps, customer lists, and trade secrets.",
      "type": "confidentiality",
      "confidence": 0.98
    },
    {
      "id": "2",
      "title": "Obligations of Receiving Party",
      "text": "The Receiving Party agrees to: (a) maintain the Confidential Information in strict confidence; (b) not disclose it to any third party without prior written consent; (c) use it solely for the Purpose; and (d) return or destroy it upon request.",
      "type": "confidentiality",
      "confidence": 0.97
    },
    {
      "id": "3",
      "title": "Exclusions",
      "text": "Confidential Information does not include information that: (a) is or becomes publicly available through no fault of the Receiving Party; (b) was rightfully in the Receiving Party's possession prior to disclosure; (c) is independently developed by the Receiving Party; or (d) is required to be disclosed by law.",
      "type": "confidentiality",
      "confidence": 0.96
    },
    {
      "id": "4",
      "title": "Term and Termination",
      "text": "This Agreement shall commence on the Effective Date and continue for a period of two years, unless earlier terminated by either party upon 30 days written notice. The obligations of confidentiality shall survive termination for a period of three years.",
      "type": "termination",
      "confidence": 0.99
    }
  ],
  "obligations": [
    {
      "id": "obl-1",
      "description": "Maintain Confidential Information in strict confidence.",
      "obligor": "Beta Inc",
      "beneficiary": "Acme Corporation",
      "type": "confidentiality",
      "deadlineType": "ongoing",
      "status": "pending",
      "clauseRef": "2",
      "confidence": 0.97
    },
    {
      "id": "obl-2",
      "description": "Use Confidential Information solely for evaluation of strategic partnership.",
      "obligor": "Beta Inc",
      "beneficiary": "Acme Corporation",
      "type": "confidentiality",
      "deadlineType": "ongoing",
      "status": "pending",
      "clauseRef": "2",
      "confidence": 0.95
    },
    {
      "id": "obl-3",
      "description": "Return or destroy Confidential Information upon request.",
      "obligor": "Beta Inc",
      "beneficiary": "Acme Corporation",
      "type": "confidentiality",
      "deadlineType": "conditional",
      "status": "pending",
      "clauseRef": "2",
      "confidence": 0.94
    }
  ],
  "risks": [
    {
      "id": "risk-1",
      "description": "No express restriction on using Confidential Information for purposes beyond the evaluation.",
      "severity": "medium",
      "category": "legal",
      "impact": "Receiving party could arguably use confidential data for competitive advantage outside the stated purpose.",
      "affectedParty": "Acme Corporation",
      "clauseRef": "2",
      "confidence": 0.85
    },
    {
      "id": "risk-2",
      "description": "Three-year survival period for confidentiality obligations after termination is relatively long.",
      "severity": "low",
      "category": "legal",
      "impact": "Extended confidentiality burden on receiving party post-termination.",
      "affectedParty": "Beta Inc",
      "clauseRef": "4",
      "confidence": 0.9
    }
  ],
  "definitions": [
    {
      "term": "Confidential Information",
      "definition": "Any information, technical data, or know-how disclosed by one party to the other in connection with the Purpose.",
      "clauseRef": "1"
    },
    {
      "term": "Purpose",
      "definition": "Evaluation of a potential strategic partnership between the parties.",
      "clauseRef": "1"
    },
    {
      "term": "Receiving Party",
      "definition": "The party that receives Confidential Information from the Disclosing Party.",
      "clauseRef": "2"
    }
  ],
  "metadata": {
    "extractedAt": "2026-05-25T14:30:00Z",
    "extractedBy": "Docfide Engine",
    "extractionEngine": {
      "name": "docfide-extract",
      "version": "0.4.2"
    },
    "confidence": 0.92,
    "sourceDocument": {
      "filename": "NDA_Acme_Beta_2026-03-15.pdf",
      "mediaType": "application/pdf",
      "size": 245760,
      "pages": 6
    },
    "tags": ["nda", "mutual", "strategic-partnership"]
  }
}
